[
  {
    "id": "step.bridge.j1",
    "version": 1,
    "type": "intro",
    "prompt_key": "step.bridge.j1.prompt",
    "concepts": ["concept.force"],
    "skills": [],
    "hint_ladder": "hints.bridge.j1"
  },
  {
    "id": "step.bridge.j2",
    "version": 1,
    "type": "activity",
    "prompt_key": "step.bridge.j2.prompt",
    "concepts": ["concept.force"],
    "skills": ["skill.experimentation"],
    "experience_ref": "exp.bridge.j",
    "hint_ladder": "hints.bridge.j2"
  },
  {
    "id": "step.bridge.e1",
    "version": 1,
    "type": "learn",
    "prompt_key": "step.bridge.e1.prompt",
    "concepts": ["concept.load"],
    "skills": [],
    "hint_ladder": "hints.bridge.e1"
  },
  {
    "id": "step.bridge.e2",
    "version": 1,
    "type": "experiment",
    "prompt_key": "step.bridge.e2.prompt",
    "concepts": ["concept.load", "concept.structure"],
    "skills": ["skill.experimentation"],
    "experience_ref": "exp.bridge.e",
    "hint_ladder": "hints.bridge.e2",
    "assessment": "assess.bridge.e2"
  },
  {
    "id": "step.bridge.m1",
    "version": 1,
    "type": "learn",
    "prompt_key": "step.bridge.m1.prompt",
    "concepts": ["concept.structure"],
    "skills": [],
    "hint_ladder": "hints.bridge.m1"
  },
  {
    "id": "step.bridge.m2",
    "version": 1,
    "type": "challenge",
    "prompt_key": "step.bridge.m2.prompt",
    "concepts": ["concept.structure", "concept.load"],
    "skills": ["skill.experimentation"],
    "experience_ref": "exp.bridge.m",
    "hint_ladder": "hints.bridge.m2"
  }
]
